{
    "$schema": "../../src/schemas/restaurant-menu.schema.json",
    "version": 1,
    "restaurant": {
        "id": "bella-vita",
        "name": "Bella Vita",
        "logo": "https://storage.googleapis.com/lightweight-menu/bella-vita/logo/bella-vita-logo.png",
        "subtitle": "El lugar y ambiente perfecto para disfrutar de un buen café",
        "address": "https://maps.app.goo.gl/ycay8kxd6rso7U367",
        "description": "",
        "currency": "COP",
        "locale": "es-CO",
        "theme": "light",
        "colors": {
            "fg": "#E6E5DA",
            "bg": "#422c06",
            "action": "#704c0f",
            "muted": "#422c06"
        },
        "updatedAt": "2026-01-14T00:07:56.845Z"
    },
    "socialMedia": [
        {
            "name": "instagram",
            "url": "https://www.instagram.com/bellavita.cafebar"
        },
        {
            "name": "facebook",
            "url": "https://www.facebook.com/bellavitacafebarbuga"
        }
    ],
    "additionalLinks": [
        {
            "label": "Envío de foto para Impresión",
            "url": "http://fw.evebot.cc/?#/en/select_ws?id=214911"
        }
    ],
    "menus": [
        {
            "id": "default",
            "label": "",
            "categories": [
                {
                    "id": "bebidas-de-autor",
                    "label": "Bebidas de Autor",
                    "items": [
                        {
                            "id": "lychee-mojito",
                            "name": "Lychee Mojito",
                            "description": "Mojito de lychee con café",
                            "price": 35000,
                            "labels": null,
                            "display": false,
                            "image": {
                                "src": "https://storage.googleapis.com/lightweight-menu/bella-vita/meals/lychee-mojito.webp",
                                "alt": "Lychee Mojito"
                            },
                            "imageThumbnail": {
                                "src": "https://storage.googleapis.com/lightweight-menu/bella-vita/meals/lychee-mojito_tn.webp",
                                "alt": "Lychee Mojito"
                            }
                        },
                        {
                            "id": "bubble-green-apple",
                            "name": "Bubble Green Apple",
                            "description": "Soda de manzana verde con café",
                            "price": 30000,
                            "labels": null,
                            "image": {
                                "src": "https://storage.googleapis.com/lightweight-menu/bella-vita/meals/bubble-green.webp",
                                "alt": ""
                            },
                            "imageThumbnail": {
                                "src": "https://storage.googleapis.com/lightweight-menu/bella-vita/meals/bubble-green_tn.webp",
                                "alt": ""
                            }
                        },
                        {
                            "id": "slushie-blueberry",
                            "name": "Slushie de Blueberry",
                            "description": "Frappe de blueberry",
                            "price": 30000,
                            "labels": null,
                            "image": {
                                "src": "https://storage.googleapis.com/lightweight-menu/bella-vita/meals/slushie-blueberry.webp",
                                "alt": ""
                            },
                            "imageThumbnail": {
                                "src": "https://storage.googleapis.com/lightweight-menu/bella-vita/meals/slushie-blueberry_tn.webp",
                                "alt": ""
                            }
                        },
                        {
                            "id": "slushie-mango-biche",
                            "name": "Slushie de Mango Biche",
                            "description": "Frappe de Mango Biche",
                            "price": 24000,
                            "labels": null,
                            "image": {
                                "src": "https://storage.googleapis.com/lightweight-menu/bella-vita/meals/slushie-mango-biche.webp",
                                "alt": ""
                            },
                            "imageThumbnail": {
                                "src": "https://storage.googleapis.com/lightweight-menu/bella-vita/meals/slushie-mango-biche_tn.webp",
                                "alt": ""
                            }
                        },
                        {
                            "id": "soda-frutos-amarillos",
                            "name": "Soda Frutos Amarillos",
                            "description": "Soda de frutos amarillos con café",
                            "price": 28000,
                            "labels": null,
                            "image": {
                                "src": "https://storage.googleapis.com/lightweight-menu/bella-vita/meals/soda-frutos-amarillos.webp",
                                "alt": ""
                            },
                            "imageThumbnail": {
                                "src": "https://storage.googleapis.com/lightweight-menu/bella-vita/meals/soda-frutos-amarillos_tn.webp",
                                "alt": ""
                            }
                        },
                        {
                            "id": "soda-frutos-rojos",
                            "name": "Soda Frutos Rojos",
                            "description": "Soda de frutos rojos con café",
                            "price": 28000,
                            "labels": null,
                            "image": {
                                "src": "https://storage.googleapis.com/lightweight-menu/bella-vita/meals/soda-frutos-rojos.webp",
                                "alt": ""
                            },
                            "imageThumbnail": {
                                "src": "https://storage.googleapis.com/lightweight-menu/bella-vita/meals/soda-frutos-rojos_tn.webp",
                                "alt": ""
                            }
                        },
                        {
                            "id": "malteada-ferrero",
                            "name": "Malteada Ferrero",
                            "description": null,
                            "price": 28000,
                            "labels": null,
                            "image": {
                                "src": "https://storage.googleapis.com/lightweight-menu/bella-vita/meals/malteada-ferrero.png",
                                "alt": ""
                            },
                            "imageThumbnail": {
                                "src": "https://storage.googleapis.com/lightweight-menu/bella-vita/meals/malteada-ferrero_tn.png",
                                "alt": ""
                            }
                        },
                        {
                            "id": "malteada-cold-brew",
                            "name": "Malteada de Cold Brew",
                            "description": "Malteada con cafe",
                            "price": 25000,
                            "labels": null,
                            "image": {
                                "src": "https://storage.googleapis.com/lightweight-menu/bella-vita/meals/malteada-cold-brew.jpg",
                                "alt": ""
                            },
                            "imageThumbnail": {
                                "src": "https://storage.googleapis.com/lightweight-menu/bella-vita/meals/malteada-cold-brew_tn.jpg",
                                "alt": ""
                            }
                        },
                        {
                            "id": "malteada-de-red-velvet",
                            "name": "Malteada de Red Velvet",
                            "description": null,
                            "price": 28000,
                            "labels": null,
                            "image": {
                                "src": "https://storage.googleapis.com/lightweight-menu/bella-vita/meals/malteada-red-velvet.webp",
                                "alt": ""
                            },
                            "imageThumbnail": {
                                "src": "https://storage.googleapis.com/lightweight-menu/bella-vita/meals/malteada-red-velvet_tn.webp",
                                "alt": ""
                            }
                        },
                        {
                            "id": "malteada-de-chocoramo",
                            "name": "Malteada de Chocoramo",
                            "description": null,
                            "price": 27000,
                            "labels": null,
                            "display": false,
                            "image": {
                                "src": "https://storage.googleapis.com/lightweight-menu/bella-vita/meals/malteada-chocorramo.png",
                                "alt": ""
                            },
                            "imageThumbnail": {
                                "src": "https://storage.googleapis.com/lightweight-menu/bella-vita/meals/malteada-chocorramo_tn.png",
                                "alt": ""
                            }
                        },
                        {
                            "id": "malteada-de-vainilla",
                            "name": "Malteada de Vainilla",
                            "description": null,
                            "price": 20000,
                            "labels": null,